{
  "$comment": "Wallboard style: a glanceable screen for operations — a control room, a shop floor or a team TV. Very large type, high contrast, thick marks, little text, readable from a few metres. Usually shown dark.",
  "meta": {
    "id": "wallboard",
    "label": "Wallboard",
    "persona": "for Operations",
    "summary": "A screen read from a few metres: very large figures, high contrast, thick columns and bars, variances as large coloured chips, few labels.",
    "brandSlot": "color.*.accent.*, typography.family.*"
  },
  "color": {
    "light": {
      "surface": {
        "page": "#E9EDF1",
        "panel": "#FFFFFF",
        "tile": "#FFFFFF",
        "edge": "#D3DAE2",
        "backdrop": "none"
      },
      "text": {
        "primary": "#0B0F14",
        "secondary": "#46505C",
        "onAccent": "#FFFFFF"
      },
      "impact": {
        "good": "#1B8A4C",
        "bad": "#CC2F27",
        "neutral": "#1F63CC",
        "cvd": {
          "good": "#0A7C90",
          "bad": "#CC2F27",
          "neutral": "#1F63CC"
        }
      },
      "scenario": {
        "ac": "#0B0F14",
        "py": "#A3ADB9",
        "pl": "#0B0F14",
        "fc": "#0B0F14"
      },
      "accent": {
        "primary": "#0B0F14",
        "highlight": "#1F63CC"
      },
      "chart": {
        "axis": "#0B0F14",
        "grid": "transparent",
        "label": "#0B0F14"
      }
    },
    "dark": {
      "surface": {
        "page": "#06090D",
        "panel": "#10161E",
        "tile": "#10161E",
        "edge": "#1F2833",
        "backdrop": "none"
      },
      "text": {
        "primary": "#F4F7FA",
        "secondary": "#AAB5C2",
        "onAccent": "#06090D"
      },
      "impact": {
        "good": "#3BD97F",
        "bad": "#FF5E57",
        "neutral": "#5EA8FF",
        "cvd": {
          "good": "#33C7DB",
          "bad": "#FF5E57",
          "neutral": "#5EA8FF"
        }
      },
      "scenario": {
        "ac": "#F4F7FA",
        "py": "#5A6573",
        "pl": "#F4F7FA",
        "fc": "#F4F7FA"
      },
      "accent": {
        "primary": "#F4F7FA",
        "highlight": "#5EA8FF"
      },
      "chart": {
        "axis": "#F4F7FA",
        "grid": "transparent",
        "label": "#F4F7FA"
      }
    }
  },
  "typography": {
    "family": {
      "text": "Inter, system-ui, sans-serif",
      "display": "Inter, system-ui, sans-serif",
      "figures": "Inter, system-ui, sans-serif"
    },
    "weight": {
      "regular": 500,
      "emphasis": 700,
      "display": 800
    },
    "size": {
      "message": 24,
      "title": 18,
      "body": 16,
      "label": 15,
      "footnote": 13,
      "figure": 56,
      "hero": 56
    }
  },
  "radius": {
    "hero": 6,
    "panel": 6,
    "tile": 6,
    "control": 6,
    "mark": 2
  },
  "density": {
    "gap": 16,
    "pad": 20,
    "maxVisuals": 3,
    "tilesPerRow": 4,
    "phoneScale": 0.75
  },
  "motion": {
    "enabled": false,
    "durationMs": 0,
    "easing": "linear"
  },
  "chart": {
    "scenarioEncoding": "pattern",
    "gridlines": "none",
    "timeSeries": "wall-columns",
    "variance": "chips",
    "structure": "wall-bars",
    "kpi": "wall-tile",
    "allowed": [],
    "onRequest": [],
    "banned": [
      "pie",
      "ring",
      "gauge",
      "funnel",
      "radar",
      "traffic-light",
      "pseudo-3d",
      "waffle",
      "pictogram",
      "area-scaled-icons",
      "truncated-axis"
    ],
    "relaxes": [
      {
        "rule": "SI 1.2",
        "what": "A contrasting page behind the tiles and cards (light: grey; dark: near-black with slate panels).",
        "why": "Zones must separate at a glance from a distance; dark keeps a lit-room screen from glaring.",
        "condition": "Impact and scenario colours are tuned per mode and contrast-checked; print is always light."
      },
      {
        "rule": "CO 1.1",
        "what": "Very large type: KPI values 56 px, labels 15 px, the message 24 px.",
        "why": "Read from a few metres on a wall screen or a team TV."
      },
      {
        "rule": "SI 2.1",
        "what": "Tiles and cards with a 6 px radius on a contrasting page.",
        "why": "Separates the zones at a glance; chrome only, the marks carry no shade."
      },
      {
        "rule": "CO 2.2",
        "what": "Fewer labels: AC values on the columns and the ΔPY% row, no PY value labels.",
        "why": "A glance, not an analysis; PY stays visible as the reference column and in the KPI tiles.",
        "condition": "Every value of the shared set is still printed somewhere on the page."
      },
      {
        "rule": "CO 1.3",
        "what": "At most 3 visuals a page.",
        "why": "A wall screen carries one situation; detail lives in the IBCS page."
      }
    ]
  }
}
