{
  "$comment": "Soft style: new. Light, warm, rounded and calm for readers outside finance (HR, people, wellbeing, internal services).",
  "meta": {
    "id": "soft",
    "label": "Soft",
    "persona": "for HR / People",
    "summary": "Warm page, rounded cards, calm colours, generous spacing and larger text; IBCS notation kept in a softer ink. Light: off-white and white cards; dark: warm charcoal.",
    "brandSlot": "color.*.accent.*, color.*.surface.page, typography.family.*"
  },
  "color": {
    "light": {
      "surface": {
        "page": "#FBF7F2",
        "panel": "#FFFFFF",
        "tile": "#FFFFFF",
        "edge": "#EDE6DC",
        "backdrop": "none"
      },
      "text": {
        "primary": "#2A2733",
        "secondary": "#5F5A6B",
        "onAccent": "#FFFFFF"
      },
      "impact": {
        "good": "#389A62",
        "bad": "#C0392B",
        "neutral": "#3D6FC4",
        "cvd": {
          "good": "#1F8C9E",
          "bad": "#C0392B",
          "neutral": "#3D6FC4"
        }
      },
      "scenario": {
        "ac": "#4A4E69",
        "py": "#C9C5D6",
        "pl": "#4A4E69",
        "fc": "#4A4E69"
      },
      "accent": {
        "primary": "#7A68B8",
        "highlight": "#D9973F"
      },
      "chart": {
        "axis": "#B9B2C4",
        "grid": "#F0EBE4",
        "label": "#2A2733"
      }
    },
    "dark": {
      "surface": {
        "page": "#1C1A21",
        "panel": "#26232D",
        "tile": "#26232D",
        "edge": "#34303C",
        "backdrop": "none"
      },
      "text": {
        "primary": "#F1EDF5",
        "secondary": "#B5AFC0",
        "onAccent": "#1C1A21"
      },
      "impact": {
        "good": "#63C68C",
        "bad": "#F07A6E",
        "neutral": "#7FA4EE",
        "cvd": {
          "good": "#4FC0D0",
          "bad": "#F07A6E",
          "neutral": "#7FA4EE"
        }
      },
      "scenario": {
        "ac": "#E4E0EE",
        "py": "#6B6578",
        "pl": "#E4E0EE",
        "fc": "#E4E0EE"
      },
      "accent": {
        "primary": "#B3A4E8",
        "highlight": "#E8B163"
      },
      "chart": {
        "axis": "#5C5668",
        "grid": "#302C37",
        "label": "#F1EDF5"
      }
    }
  },
  "typography": {
    "family": {
      "text": "\"Nunito Sans\", system-ui, sans-serif",
      "display": "Nunito, \"Nunito Sans\", system-ui, sans-serif",
      "figures": "\"Nunito Sans\", system-ui, sans-serif"
    },
    "weight": {
      "regular": 400,
      "emphasis": 700,
      "display": 800
    },
    "size": {
      "message": 20,
      "title": 16,
      "body": 15,
      "label": 13,
      "footnote": 12,
      "figure": 30,
      "hero": 30
    }
  },
  "radius": {
    "hero": 24,
    "panel": 20,
    "tile": 18,
    "control": 12,
    "mark": 4
  },
  "density": {
    "gap": 24,
    "pad": 28,
    "maxVisuals": 4,
    "tilesPerRow": 4,
    "phoneScale": 1.0
  },
  "motion": {
    "enabled": true,
    "durationMs": 280,
    "easing": "ease-out"
  },
  "chart": {
    "scenarioEncoding": "pattern",
    "gridlines": "faint",
    "timeSeries": "soft-columns",
    "variance": "pins",
    "structure": "soft-bars",
    "kpi": "soft-tile",
    "allowed": [],
    "onRequest": [],
    "banned": [
      "pie",
      "ring",
      "gauge",
      "funnel",
      "radar",
      "traffic-light",
      "pseudo-3d",
      "pictogram"
    ],
    "relaxes": [
      {
        "rule": "SI 1.2",
        "what": "Warm off-white page behind white cards (dark: warm charcoal with slightly lighter cards).",
        "why": "Calm, familiar look for non-finance readers; charts sit on white."
      },
      {
        "rule": "SI 2.2",
        "what": "AC in a soft blue-grey ink (#4A4E69 light, #E4E0EE dark) instead of a neutral dark grey.",
        "why": "The calmer ink is the style; the tint is low-saturation, far from every impact hue, and AC stays clearly stronger than PY (checked).",
        "condition": "Never a second colour for a second series; further scenarios keep their IBCS fills."
      },
      {
        "rule": "SI 2.1",
        "what": "Rounded cards (18–24 px) with one soft shadow; bar ends rounded 4 px.",
        "why": "Chrome softness; a 4 px radius on a bar of 20+ px keeps the length readable.",
        "condition": "No radius on bars thinner than 8 px."
      },
      {
        "rule": "CO 1.1",
        "what": "Larger text (body 15, labels 13 px).",
        "why": "Readers outside finance, often on phones."
      },
      {
        "rule": "CO 2.2",
        "what": "Generous spacing; at most 4 visuals a page.",
        "why": "Lower density is the point of the style; split a dense page into two. Lower density never means filler: every element carries a message."
      },
      {
        "rule": "SI 3.1",
        "what": "Faint horizontal gridlines where data labels are dropped for readability.",
        "why": "Helps readers who do not read value labels first.",
        "condition": "Gridlines or data labels on a visual, never both."
      },
      {
        "rule": "SI 1.3",
        "what": "A short fade on entry.",
        "why": "Calm feel.",
        "condition": "Off under prefers-reduced-motion; numbers are final from the first frame."
      }
    ]
  }
}
