{
  "$comment": "Annual style: the key-figures spread of a calm annual report, for investors and the board. Aubergine and gold, light-weight numerals, a tinted message band, AC columns with a PY marker line and numbered callouts, ranked bars with a PY marker.",
  "meta": {
    "id": "annual",
    "label": "Annual",
    "persona": "for Investors",
    "summary": "An annual-report spread: a tinted message band, light-weight numerals, AC columns and bars with a PY marker line, numbered callouts, generous space.",
    "brandSlot": "color.*.scenario.ac, color.*.scenario.pl, color.*.scenario.fc, color.*.accent.*, color.*.surface.panel, typography.family.*"
  },
  "color": {
    "light": {
      "surface": {
        "page": "#FFFFFF",
        "panel": "#F4F1F7",
        "tile": "#FFFFFF",
        "edge": "#E4DFEA",
        "backdrop": "none"
      },
      "text": {
        "primary": "#231B2E",
        "secondary": "#5A5166",
        "onAccent": "#FFFFFF"
      },
      "impact": {
        "good": "#2A8550",
        "bad": "#BE3A2E",
        "neutral": "#3365B8",
        "cvd": {
          "good": "#0E7F8F",
          "bad": "#BE3A2E",
          "neutral": "#3365B8"
        }
      },
      "scenario": {
        "ac": "#4B2A63",
        "py": "#CFC6DA",
        "pl": "#4B2A63",
        "fc": "#4B2A63"
      },
      "accent": {
        "primary": "#4B2A63",
        "highlight": "#B8862B"
      },
      "chart": {
        "axis": "#231B2E",
        "grid": "transparent",
        "label": "#231B2E"
      }
    },
    "dark": {
      "surface": {
        "page": "#17131D",
        "panel": "#221C2B",
        "tile": "#17131D",
        "edge": "#352C41",
        "backdrop": "none"
      },
      "text": {
        "primary": "#F0EBF5",
        "secondary": "#B2A8BF",
        "onAccent": "#17131D"
      },
      "impact": {
        "good": "#5FC487",
        "bad": "#F17A6C",
        "neutral": "#7EA6F0",
        "cvd": {
          "good": "#4CC2D0",
          "bad": "#F17A6C",
          "neutral": "#7EA6F0"
        }
      },
      "scenario": {
        "ac": "#CDB6E6",
        "py": "#5A4D6A",
        "pl": "#CDB6E6",
        "fc": "#CDB6E6"
      },
      "accent": {
        "primary": "#CDB6E6",
        "highlight": "#E3B25A"
      },
      "chart": {
        "axis": "#F0EBF5",
        "grid": "transparent",
        "label": "#F0EBF5"
      }
    }
  },
  "typography": {
    "family": {
      "text": "Manrope, system-ui, sans-serif",
      "display": "Manrope, system-ui, sans-serif",
      "figures": "Manrope, system-ui, sans-serif"
    },
    "weight": {
      "regular": 400,
      "emphasis": 700,
      "display": 300
    },
    "size": {
      "message": 22,
      "title": 16,
      "body": 15,
      "label": 13,
      "footnote": 12,
      "figure": 44,
      "hero": 44
    }
  },
  "radius": {
    "hero": 4,
    "panel": 4,
    "tile": 4,
    "control": 4,
    "mark": 0
  },
  "density": {
    "gap": 32,
    "pad": 28,
    "maxVisuals": 3,
    "tilesPerRow": 4,
    "phoneScale": 0.8
  },
  "motion": {
    "enabled": false,
    "durationMs": 0,
    "easing": "linear"
  },
  "chart": {
    "scenarioEncoding": "pattern",
    "gridlines": "none",
    "timeSeries": "marker-columns",
    "variance": "numbered-callouts",
    "structure": "marker-bars",
    "kpi": "big-figures",
    "allowed": [],
    "onRequest": [],
    "banned": [
      "pie",
      "ring",
      "gauge",
      "funnel",
      "radar",
      "traffic-light",
      "pseudo-3d",
      "waffle",
      "pictogram",
      "area-scaled-icons",
      "truncated-axis"
    ],
    "relaxes": [
      {
        "rule": "SI 1.2",
        "what": "A tinted band behind the key message and white (dark: plum) panels without boxes.",
        "why": "The annual-report cover gesture: one focal point per page.",
        "condition": "The tint is the brand surface, never green or red, and never encodes data."
      },
      {
        "rule": "SI 2.3",
        "what": "Light-weight display numerals (44 px) for the KPI values.",
        "why": "The calm, generous voice of an annual report; labels and variances stay regular weight."
      },
      {
        "rule": "CO 1.1",
        "what": "Large KPI figures and message.",
        "why": "Read in print and on screens at a distance."
      },
      {
        "rule": "UN 3.2",
        "what": "PY drawn as a marker line across the AC column or bar, not as a second column or bar.",
        "why": "One solid shape per category reads calmer; the marker keeps the comparison exact.",
        "condition": "AC stays solid, PY the marker; both are named in the legend."
      },
      {
        "rule": "SI 2.2",
        "what": "AC in the aubergine brand colour instead of a neutral dark grey.",
        "why": "The brand carries the report; the colour is far from every impact hue and AC stays clearly stronger than PY (checked)."
      },
      {
        "rule": "CO 1.3",
        "what": "At most 3 visuals a page.",
        "why": "One message per spread; detail lives in the IBCS page."
      }
    ]
  }
}
